Extracted contents:
header:          00 ff ff ff ff ff ff 00
serial number:   4a 8b 32 bc 01 01 01 01 09 1a
version:         01 04
basic params:    a2 3c 22 78 3e
chroma info:     27 15 ac 51 35 b5 26 0e 50 54
established:     bf ef 80
standard:        d1 c0 d1 e8 d1 fc 95 00 90 40 81 80 81 40 81 c0
descriptor 1:    40 d0 00 a0 f0 70 3e 80 30 20 35 00 54 4f 21 00 00 1a
descriptor 2:    00 00 00 fc 00 48 44 4d 49 20 55 48 44 20 48 44 52 0a
descriptor 3:    46 37 80 b4 70 38 2d 40 2c 16 35 00 54 4f 21 00 00 1a
descriptor 4:    00 00 00 fd 00 30 3c 86 86 36 01 0a 20 20 20 20 20 20
extensions:      01
checksum:        cf

Manufacturer: RTK Model bc32 Serial Number 16843009
Made week 9 of 2016
EDID version: 1.4
Digital display
8 bits per primary color channel
HDMI-a interface
Maximum image size: 60 cm x 34 cm
Gamma: 2.20
DPMS levels: Off
Supported color formats: RGB 4:4:4, YCrCb 4:4:4, YCrCb 4:2:2
Default (sRGB) color space is primary color space
First detailed timing is preferred timing
Chroma Info:
Red X: 0.671875 Y: 0.318359
Green X: 0.208008 Y: 0.709961
Blue X: 0.148438 Y: 0.055664
White X: 0.313477 Y: 0.329102
Established timings supported:
  720x400@70Hz
  640x480@60Hz
  640x480@67Hz
  640x480@72Hz
  640x480@75Hz
  800x600@56Hz
  800x600@60Hz
  800x600@72Hz
  800x600@75Hz
  832x624@75Hz
  1024x768@60Hz
  1024x768@70Hz
  1024x768@75Hz
  1280x1024@75Hz
  1152x870@75Hz
Standard timings supported:
  1920x1080@60Hz
  1920x1080@100Hz
  1920x1080@120Hz
  1440x900@60Hz
  1400x1050@60Hz
  1280x1024@60Hz
  1280x960@60Hz
  1280x720@60Hz
Detailed mode: Clock 533.120 MHz, 596 mm x 335 mm
               3840 3888 3920 4000 hborder 0
               2160 2163 2168 2222 vborder 0
               +hsync -vsync 
Monitor name: HDMI
Detailed mode: Clock 141.500 MHz, 596 mm x 335 mm
               1920 1964 1986 2100 hborder 0
               1080 1083 1088 1125 vborder 0
               +hsync -vsync 
Monitor ranges (bare limits): 48-60Hz V, 134-134kHz H, max dotclock 540MHz
Has 1 extension blocks
Checksum: 0xcf (valid)

CEA extension block
Extension version: 3
77 bytes of CEA data
  Video data block
    VIC 04 1280x720@60Hz 
    VIC 05 1920x1080i@60Hz 
    VIC 16 1920x1080@60Hz 
    VIC 19 1280x720@50Hz 
    VIC 20 1920x1080i@50Hz 
    VIC 31 1920x1080@50Hz 
    VIC 32 1920x1080@24Hz 
    VIC 33 1920x1080@25Hz 
    VIC 34 1920x1080@30Hz 
    VIC 39 1920x1080i@50Hz 
    VIC 72 Unknown mode 
    VIC 73 Unknown mode 
    VIC 74 Unknown mode 
    VIC 75 Unknown mode 
    VIC 76 Unknown mode 
    VIC 93 Unknown mode 
    VIC 94 Unknown mode 
    VIC 95 Unknown mode 
    VIC 96 Unknown mode 
    VIC 97 Unknown mode 
    VIC 98 Unknown mode 
    VIC 99 Unknown mode 
    VIC 100 Unknown mode 
    VIC 101 Unknown mode 
    VIC 102 Unknown mode 
    VIC 103 Unknown mode 
    VIC 104 Unknown mode 
    VIC 105 Unknown mode 
    VIC 106 Unknown mode 
    VIC 107 Unknown mode 
  Extended tag: video capability data block
    YCbCr quantization: Selectable (via AVI YQ) (1)
    RGB quantization: Selectable (via AVI Q) (1)
    PT scan behaviour: Always Overscannned (1)
    IT scan behaviour: Always Overscannned (1)
    CE scan behaviour: Always Overscannned (1)
  Extended tag: Colorimetry data block
  Audio data block
    Linear PCM, max channels 1
    Supported sample rates (kHz): 192 176.4 96 88.2 48 44.1 32
    Supported sample sizes (bits): 24 20 16
  Extended tag: Reserved video block (0f)
  Vendor-specific data block, OUI 000c03 (HDMI)
    Source physical address 1.0.0.0
    DC_36bit
    DC_30bit
    DC_Y444
    Maximum TMDS clock: 600MHz
    Extended HDMI video details:
      HDMI VIC 0 3840x2160@30Hz
      HDMI VIC 1 3840x2160@25Hz
      HDMI VIC 2 3840x2160@24Hz
  Vendor-specific data block, OUI c45dd8
  Extended tag: Reserved video block (06)
Underscans PC formats by default
Basic audio support
Supports YCbCr 4:4:4
Supports YCbCr 4:2:2
2 native detailed modes
Detailed mode: Clock 586.000 MHz, 597 mm x 336 mm
               2560 2568 2600 2640 hborder 0
               1440 1465 1473 1543 vborder 0
               +hsync +vsync 
Detailed mode: Clock 242.000 MHz, 597 mm x 336 mm
               2560 2582 2626 2720 hborder 0
               1440 1443 1448 1485 vborder 0
               +hsync +vsync 
Checksum: 0x82 (valid)

EDID block does NOT conform to EDID 1.3!
	Detailed block string not properly terminated
EDID block does not conform at all!
	Invalid detailed timing descriptor ordering
