Extracted contents:
header:          00 ff ff ff ff ff ff 00
serial number:   06 10 f0 9c 00 00 00 00 11 16
version:         01 04
basic params:    95 1d 12 78 02
chroma info:     ef 05 97 57 54 92 27 22 50 54
established:     00 00 00
standard:        01 01 01 01 01 01 01 01 01 01 01 01 01 01 01 01
descriptor 1:    b9 22 a0 a0 50 84 1a 30 30 20 36 00 1e b3 00 00 00 18
descriptor 2:    00 00 00 10 00 00 00 00 00 00 00 00 00 00 00 00 00 00
descriptor 3:    00 00 00 fe 00 4c 53 4e 31 33 33 42 54 30 31 41 30 32
descriptor 4:    00 00 00 fc 00 43 6f 6c 6f 72 20 4c 43 44 0a 20 20 20
extensions:      00
checksum:        09

Manufacturer: APP Model 9cf0 Serial Number 0
Made week 17 of 2012
EDID version: 1.4
Digital display
6 bits per primary color channel
DisplayPort interface
Maximum image size: 29 cm x 18 cm
Gamma: 2.20
Supported color formats: RGB 4:4:4
First detailed timing is preferred timing
Established timings supported:
Standard timings supported:
Detailed mode: Clock 88.890 MHz, 30 mm x 179 mm
               1440 1488 1520 1600 hborder 0
                900  903  909  926 vborder 0
               -hsync -vsync 
Dummy block
ASCII string: LSN133BT01A02
Monitor name: Color
Checksum: 0x9 (valid)
EDID block does NOT conform to EDID 1.3!
	Missing monitor ranges
	Detailed block string not properly terminated
