Extracted contents:
header:          00 ff ff ff ff ff ff 00
serial number:   06 10 41 a0 00 00 00 00 07 1c
version:         01 04
basic params:    b5 1d 12 78 02
chroma info:     c7 91 a5 55 4f 9f 26 0f 50 54
established:     00 00 00
standard:        01 01 01 01 01 01 01 01 01 01 01 01 01 01 01 01
descriptor 1:    d9 65 00 50 a0 40 2e 60 08 20 08 08 1e b3 10 00 00 1a
descriptor 2:    00 00 00 fc 00 43 6f 6c 6f 72 20 4c 43 44 0a 20 20 20
descriptor 3:    00 00 00 10 00 00 00 00 00 00 00 00 00 00 00 00 00 00
descriptor 4:    00 00 00 10 00 00 00 00 00 00 00 00 00 00 00 00 00 00
extensions:      01
checksum:        b8

Manufacturer: APP Model a041 Serial Number 0
Made week 7 of 2018
EDID version: 1.4
Digital display
10 bits per primary color channel
DisplayPort interface
Maximum image size: 29 cm x 18 cm
Gamma: 2.20
Supported color formats: RGB 4:4:4
First detailed timing is preferred timing
Chroma Info:
Red X: 0.647461 Y: 0.332031
Green X: 0.309570 Y: 0.624023
Blue X: 0.150391 Y: 0.059570
White X: 0.312500 Y: 0.329102
Established timings supported:
Standard timings supported:
Detailed mode: Clock 260.730 MHz, 286 mm x 179 mm
               2560 2568 2600 2640 hborder 0
               1600 1632 1640 1646 vborder 0
               +hsync -vsync 
Monitor name: Color
Dummy block
Dummy block
Has 1 extension blocks
Checksum: 0xb8 (valid)

Unknown extension block

EDID block does NOT conform to EDID 1.3!
	Missing monitor ranges
	Detailed block string not properly terminated
EDID block does not conform at all!
	Has 7140522 nonconformant extension block(s)
