Extracted contents:
header:          00 ff ff ff ff ff ff 00
serial number:   06 10 c7 9c 00 00 00 00 24 13
version:         01 03
basic params:    80 1d 12 78 0a
chroma info:     e5 85 a3 54 4f 9c 26 0e 50 54
established:     00 00 00
standard:        01 01 01 01 01 01 01 01 01 01 01 01 01 01 01 01
descriptor 1:    52 1c 00 8f 50 20 2e 30 30 20 36 00 1e b3 10 00 00 19
descriptor 2:    00 00 00 01 00 06 10 20 00 00 00 00 00 00 00 00 0a 20
descriptor 3:    00 00 00 fe 00 4c 54 4e 31 33 33 41 54 30 39 00 0a 20
descriptor 4:    00 00 00 fc 00 43 6f 6c 6f 72 20 4c 43 44 0a 20 20 20
extensions:      00
checksum:        3e

Manufacturer: APP Model 9cc7 Serial Number 0
Made week 36 of 2009
EDID version: 1.3
Digital display
Maximum image size: 29 cm x 18 cm
Gamma: 2.20
Supported color formats: RGB 4:4:4, YCrCb 4:2:2
First detailed timing is preferred timing
Established timings supported:
Standard timings supported:
Detailed mode: Clock 72.500 MHz, 286 mm x 179 mm
               1280 1328 1360 1423 hborder 0
                800  803  809  846 vborder 0
               -hsync -vsync 
Manufacturer-specified data, tag 1
ASCII string: LTN133AT09
Monitor name: Color
Checksum: 0x3e (valid)
EDID block does NOT conform to EDID 1.3!
	Missing monitor ranges
	Detailed block string not properly terminated
