Extracted contents:
header:          00 ff ff ff ff ff ff 00
serial number:   90 ac 9c 40 4c 38 30 32 30 17
version:         01 04
basic params:    b5 35 1e 78 3a
chroma info:     1d f5 ae 4f 35 b3 25 0d 50 54
established:     00 00 00
standard:        01 01 01 01 01 01 01 01 01 01 01 01 01 01 01 01
descriptor 1:    4d d0 00 a0 f0 70 3e 80 30 20 35 00 0f 28 21 00 00 1a
descriptor 2:    00 00 00 ff 00 30 30 30 30 30 30 30 30 30 30 30 30 30
descriptor 3:    00 00 00 fc 00 44 45 4c 4c 20 55 50 32 34 31 34 51 0a
descriptor 4:    00 00 00 fd 00 1d 4b 1f 8c 36 00 0a 20 20 20 20 20 20
extensions:      00
checksum:        cc

Manufacturer: DEL Model 409c Serial Number 842020940
Made week 48 of 2013
EDID version: 1.4
Digital display
10 bits per primary color channel
DisplayPort interface
Maximum image size: 53 cm x 30 cm
Gamma: 2.20
DPMS levels: Off
Supported color formats: RGB 4:4:4, YCrCb 4:4:4, YCrCb 4:2:2
First detailed timing is preferred timing
Chroma Info:
Red X: 0.679688 Y: 0.309570
Green X: 0.209961 Y: 0.700195
Blue X: 0.147461 Y: 0.053711
White X: 0.313477 Y: 0.329102
Established timings supported:
Standard timings supported:
Detailed mode: Clock 533.250 MHz, 527 mm x 296 mm
               3840 3888 3920 4000 hborder 0
               2160 2163 2168 2222 vborder 0
               +hsync -vsync 
Serial number: 0000000000000
Monitor name: DELL
Monitor ranges (GTF): 29-75Hz V, 31-140kHz H, max dotclock 540MHz
Checksum: 0xcc (valid)
EDID block does NOT conform to EDID 1.3!
	Detailed block string not properly terminated
