x86info v1.31pre
Found 8 identical CPUs (but found 4294967295 CPUs in MPTable!)
Extended Family: 0 Extended Model: 7 Family: 6 Model: 126 Stepping: 5
Type: 0 (Original OEM)
CPU Model (x86info's best guess): [Icelake Mobile]
Processor name string (BIOS programmed): Intel(R) Core(TM) i7-1060NG7 CPU @ 1.20GHz

Performance msrs:

eax in: 0x00000000, eax = 0000001b ebx = 756e6547 ecx = 6c65746e edx = 49656e69
eax in: 0x00000001, eax = 000706e5 ebx = 00100800 ecx = 7ffafbbf edx = bfebfbff
eax in: 0x00000002, eax = 00feff01 ebx = 000000f0 ecx = 00000000 edx = 00000000
eax in: 0x00000003, eax = 00000000 ebx = 00000000 ecx = 00000000 edx = 00000000
eax in: 0x00000004, eax = 1c004121 ebx = 02c0003f ecx = 0000003f edx = 00000000
eax in: 0x00000005, eax = 00000040 ebx = 00000040 ecx = 00000003 edx = 11121020
eax in: 0x00000006, eax = 0017aef7 ebx = 00000002 ecx = 00000009 edx = 00000000
eax in: 0x00000007, eax = 00000000 ebx = 00000000 ecx = 00000000 edx = 00000000
eax in: 0x00000008, eax = 00000000 ebx = 00000000 ecx = 00000000 edx = 00000000
eax in: 0x00000009, eax = 00000000 ebx = 00000000 ecx = 00000000 edx = 00000000
eax in: 0x0000000a, eax = 08300805 ebx = 00000000 ecx = 0000000f edx = 00008604
eax in: 0x0000000b, eax = 00000000 ebx = 00000000 ecx = 0000000f edx = 00000000
eax in: 0x0000000c, eax = 00000000 ebx = 00000000 ecx = 00000000 edx = 00000000
eax in: 0x0000000d, eax = 000002e7 ebx = 00000340 ecx = 00000a88 edx = 00000000
eax in: 0x0000000e, eax = 00000000 ebx = 00000000 ecx = 00000000 edx = 00000000
eax in: 0x0000000f, eax = 00000000 ebx = 00000000 ecx = 00000000 edx = 00000000
eax in: 0x00000010, eax = 00000000 ebx = 00000000 ecx = 00000000 edx = 00000000
eax in: 0x00000011, eax = 00000000 ebx = 00000000 ecx = 00000000 edx = 00000000
eax in: 0x00000012, eax = 00000000 ebx = 00000000 ecx = 00000000 edx = 00000000
eax in: 0x00000013, eax = 00000000 ebx = 00000000 ecx = 00000000 edx = 00000000
eax in: 0x00000014, eax = 00000001 ebx = 0000000f ecx = 00000007 edx = 00000000
eax in: 0x00000015, eax = 00000002 ebx = 0000003e ecx = 0249f000 edx = 00000000
eax in: 0x00000016, eax = 000004b0 ebx = 00000ed8 ecx = 00000064 edx = 00000000
eax in: 0x00000017, eax = 00000000 ebx = 00000000 ecx = 00000000 edx = 00000000
eax in: 0x00000018, eax = 00000007 ebx = 00000000 ecx = 00000000 edx = 00000000
eax in: 0x00000019, eax = 00000000 ebx = 00000000 ecx = 00000000 edx = 00000000
eax in: 0x0000001a, eax = 00000000 ebx = 00000000 ecx = 00000000 edx = 00000000
eax in: 0x0000001b, eax = 00000000 ebx = 00000000 ecx = 00000000 edx = 00000000

eax in: 0x80000000, eax = 80000008 ebx = 00000000 ecx = 00000000 edx = 00000000
eax in: 0x80000001, eax = 00000000 ebx = 00000000 ecx = 00000121 edx = 2c100800
eax in: 0x80000002, eax = 65746e49 ebx = 2952286c ecx = 726f4320 edx = 4d542865
eax in: 0x80000003, eax = 37692029 ebx = 3630312d ecx = 37474e30 edx = 55504320
eax in: 0x80000004, eax = 31204020 ebx = 4730322e ecx = 00007a48 edx = 00000000
eax in: 0x80000005, eax = 00000000 ebx = 00000000 ecx = 00000000 edx = 00000000
eax in: 0x80000006, eax = 00000000 ebx = 00000000 ecx = 01006040 edx = 00000000
eax in: 0x80000007, eax = 00000000 ebx = 00000000 ecx = 00000000 edx = 00000100
eax in: 0x80000008, eax = 00003027 ebx = 00000000 ecx = 00000000 edx = 00000000

Cache info
 L1 Data Cache: 48KB, 12-way associative, 64 byte line size
TLB info
 64 byte prefetching.
Found unknown cache descriptors: fe 
Feature flags:
 fpu vme de pse tsc msr pae mce cx8 apic sep mtrr pge mca cmov pat pse36 clflsh ds acpi mmx fxsr sse sse2 ss ht tm pbe sse3 pclmuldq dtes64 monitor ds-cpl vmx est tm2 ssse3 sdbg fma cx16 xTPR pdcm pcid sse4_1 sse4_2 x2apic movbe popcnt tsc-deadline aes xsave osxsave avx f16c rdrnd
Extended feature flags:
 SYSCALL xd pdpe1gb rdtscp em64t lahf_lm lzcnt prefetchw dts ida arat pln ecmd ptm hwp hwp_act_window hwp_epp hwp_lpr hdc [6:eax:15] [6:eax:16] [6:eax:17] [6:eax:18] [6:eax:20] fsgsbase tsc_adj sgx bmi1 avx2 fdp_excp smep bmi2 erms invpcid nofpucs avx512f avx512dq rdseed adx smap avx512ifma clflushopt ipt avx512cd sha avx512bw avx512vl nonstop_tsc
Long NOPs supported: yes

Address sizes : 39 bits physical, 48 bits virtual
1.20GHz processor (estimate).

Total processor threads: 8
This system has 1 quad-core processor with hyper-threading (2 threads per core) running at an estimated 1.20GHz
