Extracted contents:
header:          00 ff ff ff ff ff ff 00
serial number:   06 10 32 a0 6d 24 f7 a4 19 19
version:         01 04
basic params:    a5 30 1b 78 20
chroma info:     4f 51 ae 51 43 b0 26 0d 50 54
established:     00 00 00
standard:        01 01 01 01 01 01 01 01 01 01 01 01 01 01 01 01
descriptor 1:    4d d0 00 a0 f0 70 3e 80 30 20 35 00 db 0b 11 00 00 1a
descriptor 2:    1a 36 80 a0 70 38 1f 40 30 20 35 00 db 0b 11 00 00 1a
descriptor 3:    00 00 00 fc 00 69 4d 61 63 0a 20 20 20 20 20 20 20 20
descriptor 4:    00 00 00 ff 00 35 33 30 42 36 44 37 36 44 32 34 33 37
extensions:      01
checksum:        e7

Manufacturer: APP Model a032 Serial Number 2767660141
Made week 25 of 2015
EDID version: 1.4
Digital display
8 bits per primary color channel
DisplayPort interface
Maximum image size: 48 cm x 27 cm
Gamma: 2.20
DPMS levels: Off
Supported color formats: RGB 4:4:4
Chroma Info:
Red X: 0.680664 Y: 0.316406
Green X: 0.264648 Y: 0.690430
Blue X: 0.149414 Y: 0.051758
White X: 0.312500 Y: 0.329102
Established timings supported:
Standard timings supported:
Detailed mode: Clock 533.250 MHz, 475 mm x 267 mm
               3840 3888 3920 4000 hborder 0
               2160 2163 2168 2222 vborder 0
               +hsync -vsync 
Detailed mode: Clock 138.500 MHz, 475 mm x 267 mm
               1920 1968 2000 2080 hborder 0
               1080 1083 1088 1111 vborder 0
               +hsync -vsync 
Monitor name: iMac
Serial number: 530B6D76D2437
Has 1 extension blocks
Checksum: 0xe7 (valid)

Unknown extension block

EDID block does NOT conform to EDID 1.3!
	Missing preferred timing
	Missing monitor ranges
