Extracted contents:
header:          00 ff ff ff ff ff ff 00
serial number:   04 72 73 ad 48 2c 41 80 04 12
version:         01 03
basic params:    80 26 1e 6b 2a
chroma info:     67 60 a2 5a 49 9e 23 13 50 54
established:     bf ef 00
standard:        81 8f 81 80 71 4f 71 40 61 4f 61 40 45 4f 45 40
descriptor 1:    30 2a 00 98 51 00 2a 40 30 70 13 00 78 2d 11 00 00 1e
descriptor 2:    00 00 00 ff 00 4c 37 33 30 38 35 31 31 34 32 44 45 0a
descriptor 3:    00 00 00 fd 00 37 4b 1e 53 0e 00 0a 20 20 20 20 20 20
descriptor 4:    00 00 00 fc 00 41 63 65 72 20 41 4c 31 39 31 37 0a 20
extensions:      00
checksum:        e1

Manufacturer: ACR Model ad73 Serial Number 2151754824
Made week 4 of 2008
EDID version: 1.3
Digital display
Maximum image size: 38 cm x 30 cm
Gamma: 2.07
DPMS levels: Off
Supported color formats: RGB 4:4:4, YCrCb 4:2:2
First detailed timing is preferred timing
Established timings supported:
  720x400@70Hz
  640x480@60Hz
  640x480@67Hz
  640x480@72Hz
  640x480@75Hz
  800x600@56Hz
  800x600@60Hz
  800x600@72Hz
  800x600@75Hz
  832x624@75Hz
  1024x768@60Hz
  1024x768@70Hz
  1024x768@75Hz
  1280x1024@75Hz
Standard timings supported:
  1280x1024@75Hz
  1280x1024@60Hz
  1152x864@75Hz
  1152x864@60Hz
  1024x768@75Hz
  1024x768@60Hz
  800x600@75Hz
  800x600@60Hz
Detailed mode: Clock 108.000 MHz, 376 mm x 301 mm
               1280 1328 1440 1688 hborder 0
               1024 1025 1028 1066 vborder 0
               +hsync +vsync 
Serial number: L730851142DE
Monitor ranges (GTF): 55-75Hz V, 30-83kHz H, max dotclock 140MHz
Monitor name: Acer
Checksum: 0xe1 (valid)
EDID block does NOT conform to EDID 1.3!
	Detailed block string not properly terminated
