Extracted contents:
header:          00 ff ff ff ff ff ff 00
serial number:   10 ac 15 f0 4c 32 4b 31 09 15
version:         01 03
basic params:    80 34 20 78 ee
chroma info:     1e c5 ae 4f 34 b1 26 0e 50 54
established:     a5 4b 00
standard:        81 80 a9 40 d1 00 71 4f 01 01 01 01 01 01 01 01
descriptor 1:    28 3c 80 a0 70 b0 23 40 30 20 36 00 06 44 21 00 00 1a
descriptor 2:    00 00 00 ff 00 46 35 32 35 4d 31 32 4e 31 4b 32 4c 0a
descriptor 3:    00 00 00 fc 00 44 45 4c 4c 20 55 32 34 31 30 0a 20 20
descriptor 4:    00 00 00 fd 00 38 4c 1e 51 11 00 0a 20 20 20 20 20 20
extensions:      00
checksum:        7c

Manufacturer: DEL Model f015 Serial Number 827011660
Made week 9 of 2011
EDID version: 1.3
Digital display
Maximum image size: 52 cm x 32 cm
Gamma: 2.20
DPMS levels: Standby Suspend Off
Supported color formats: RGB 4:4:4, YCrCb 4:2:2
Default (sRGB) color space is primary color space
First detailed timing is preferred timing
Established timings supported:
  720x400@70Hz
  640x480@60Hz
  640x480@75Hz
  800x600@60Hz
  800x600@75Hz
  1024x768@60Hz
  1024x768@75Hz
  1280x1024@75Hz
Standard timings supported:
  1280x1024@60Hz
  1600x1200@60Hz
  1920x1200@60Hz
  1152x864@75Hz
Detailed mode: Clock 154.000 MHz, 518 mm x 324 mm
               1920 1968 2000 2080 hborder 0
               1200 1203 1209 1235 vborder 0
               +hsync -vsync 
Serial number: F525M12N1K2L
Monitor name: DELL
Monitor ranges (GTF): 56-76Hz V, 30-81kHz H, max dotclock 170MHz
Checksum: 0x7c (valid)
EDID block does NOT conform to EDID 1.3!
	Detailed block string not properly terminated
