Extracted contents:
header:          00 ff ff ff ff ff ff 00
serial number:   06 10 40 a0 00 00 00 00 10 1b
version:         01 04
basic params:    b5 21 15 78 02
chroma info:     0f 91 ae 52 43 b0 26 0d 50 54
established:     00 00 00
standard:        01 01 01 01 01 01 01 01 01 01 01 01 01 01 01 01
descriptor 1:    7c 80 40 50 b0 08 34 70 08 20 68 08 4b cf 10 00 00 1a
descriptor 2:    00 00 00 fc 00 43 6f 6c 6f 72 20 4c 43 44 0a 20 20 20
descriptor 3:    00 00 00 10 00 00 00 00 00 00 00 00 00 00 00 00 00 00
descriptor 4:    00 00 00 10 00 00 00 00 00 00 00 00 00 00 00 00 00 00
extensions:      01
checksum:        c4

Manufacturer: APP Model a040 Serial Number 0
Made week 16 of 2017
EDID version: 1.4
Digital display
10 bits per primary color channel
DisplayPort interface
Maximum image size: 33 cm x 21 cm
Gamma: 2.20
Supported color formats: RGB 4:4:4
First detailed timing is preferred timing
Chroma Info:
Red X: 0.679688 Y: 0.320312
Green X: 0.264648 Y: 0.690430
Blue X: 0.150391 Y: 0.051758
White X: 0.312500 Y: 0.329102
Established timings supported:
Standard timings supported:
Detailed mode: Clock 328.920 MHz, 331 mm x 207 mm
               2880 2888 2920 2960 hborder 0
               1800 1838 1846 1852 vborder 0
               +hsync -vsync 
Monitor name: Color
Dummy block
Dummy block
Has 1 extension blocks
Checksum: 0xc4 (valid)

Unknown extension block

EDID block does NOT conform to EDID 1.3!
	Missing monitor ranges
	Detailed block string not properly terminated
EDID block does not conform at all!
	Has 1134212 nonconformant extension block(s)
