Extracted contents:
header:          00 ff ff ff ff ff ff 00
serial number:   06 10 dd 9c 00 00 00 00 0a 14
version:         01 04
basic params:    a5 30 1b 78 22
chroma info:     6f b1 a7 55 4c 9e 25 0c 50 54
established:     00 00 00
standard:        01 01 01 01 01 01 01 01 01 01 01 01 01 01 01 01
descriptor 1:    1a 36 80 a0 70 38 1f 40 30 20 35 00 db 0b 11 00 00 1a
descriptor 2:    00 00 00 02 01 06 10 01 0a 01 00 00 00 00 00 00 00 00
descriptor 3:    00 00 00 fc 00 43 6f 6c 6f 72 20 4c 43 44 0a 20 20 20
descriptor 4:    00 00 00 00 00 00 00 00 00 00 00 00 00 00 00 00 00 00
extensions:      00
checksum:        55

Manufacturer: APP Model 9cdd Serial Number 0
Made week 10 of 2010
EDID version: 1.4
Digital display
8 bits per primary color channel
DisplayPort interface
Maximum image size: 48 cm x 27 cm
Gamma: 2.20
DPMS levels: Off
Supported color formats: RGB 4:4:4
First detailed timing is preferred timing
Established timings supported:
Standard timings supported:
Detailed mode: Clock 138.500 MHz, 475 mm x 267 mm
               1920 1968 2000 2080 hborder 0
               1080 1083 1088 1111 vborder 0
               +hsync -vsync 
Monitor descriptor block has byte 4 nonzero (0x01)
Manufacturer-specified data, tag 2
Monitor name: Color
Manufacturer-specified data, tag 0
Checksum: 0x55 (valid)
EDID block does NOT conform to EDID 1.3!
	Missing monitor ranges
	Invalid descriptor block padding
	Detailed block string not properly terminated
