x86info v1.31pre
Found 8 identical CPUs
Extended Family: 0 Extended Model: 3 Family: 6 Model: 62 Stepping: 4
Type: 0 (Original OEM)
CPU Model (x86info's best guess): Core i7 (IvyTown)
Processor name string (BIOS programmed): Intel(R) Xeon(R) CPU E5-1620 v2 @ 3.70GHz

eax in: 0x00000000, eax = 0000000d ebx = 756e6547 ecx = 6c65746e edx = 49656e69
eax in: 0x00000001, eax = 000306e4 ebx = 02200800 ecx = 7fbee3ff edx = bfebfbff
eax in: 0x00000002, eax = 76036301 ebx = 00f0b2ff ecx = 00000000 edx = 00ca0000
eax in: 0x00000003, eax = 00000000 ebx = 00000000 ecx = 00000000 edx = 00000000
eax in: 0x00000004, eax = 3c004121 ebx = 01c0003f ecx = 0000003f edx = 00000000
eax in: 0x00000005, eax = 00000040 ebx = 00000040 ecx = 00000003 edx = 00001120
eax in: 0x00000006, eax = 00000077 ebx = 00000002 ecx = 00000009 edx = 00000000
eax in: 0x00000007, eax = 00000000 ebx = 00000000 ecx = 00000000 edx = 00000000
eax in: 0x00000008, eax = 00000000 ebx = 00000000 ecx = 00000000 edx = 00000000
eax in: 0x00000009, eax = 00000000 ebx = 00000000 ecx = 00000000 edx = 00000000
eax in: 0x0000000a, eax = 07300403 ebx = 00000000 ecx = 00000000 edx = 00000603
eax in: 0x0000000b, eax = 00000001 ebx = 00000002 ecx = 00000100 edx = 00000002
eax in: 0x0000000c, eax = 00000000 ebx = 00000000 ecx = 00000000 edx = 00000000
eax in: 0x0000000d, eax = 00000007 ebx = 00000340 ecx = 00000340 edx = 00000000

eax in: 0x80000000, eax = 80000008 ebx = 00000000 ecx = 00000000 edx = 00000000
eax in: 0x80000001, eax = 00000000 ebx = 00000000 ecx = 00000001 edx = 2c100000
eax in: 0x80000002, eax = 20202020 ebx = 6e492020 ecx = 286c6574 edx = 58202952
eax in: 0x80000003, eax = 286e6f65 ebx = 43202952 ecx = 45205550 edx = 36312d35
eax in: 0x80000004, eax = 76203032 ebx = 20402032 ecx = 30372e33 edx = 007a4847
eax in: 0x80000005, eax = 00000000 ebx = 00000000 ecx = 00000000 edx = 00000000
eax in: 0x80000006, eax = 00000000 ebx = 00000000 ecx = 01006040 edx = 00000000
eax in: 0x80000007, eax = 00000000 ebx = 00000000 ecx = 00000000 edx = 00000100
eax in: 0x80000008, eax = 0000302e ebx = 00000000 ecx = 00000000 edx = 00000000

Cache info
 L1 Data Cache: 32KB, 8-way associative, 64 byte line size
TLB info
 Instruction TLB: 2M/4M pages, fully associative, 8 entries
 Instruction TLB: 4K pages, 4-way associative, 64 entries.
 Data TLB: 1GB pages, 4-way set associative, 4 entries
 Data TLB: 4KB pages, 4-way associative, 64 entries
 Shared L2 TLB: 4KB pages, 4-way associative, 512 entries
 64 byte prefetching.
Feature flags:
 fpu vme de pse tsc msr pae mce cx8 apic sep mtrr pge mca cmov pat pse36 clflsh ds acpi mmx fxsr sse sse2 ss ht tm pbe sse3 pclmuldq dtes64 monitor ds-cpl vmx smx est tm2 ssse3 cx16 xTPR pdcm pcid dca sse4_1 sse4_2 x2apic popcnt tsc-deadline aes xsave osxsave avx f16c rdrnd
Extended feature flags:
 xd pdpe1gb rdtscp em64t lahf_lm dts ida arat pln ecmd ptm nonstop_tsc
Long NOPs supported: yes

Address sizes : 46 bits physical, 48 bits virtual
3.70GHz processor (estimate).

Total processor threads: 8
This system has 1 quad-core processor with hyper-threading (2 threads per core) running at an estimated 3.70GHz
