Extracted contents:
header:          00 ff ff ff ff ff ff 00
serial number:   06 10 33 a0 00 00 00 00 25 19
version:         01 04
basic params:    b5 1d 12 78 02
chroma info:     0f 01 ae 52 43 b0 27 0d 50 54
established:     00 00 00
standard:        01 01 01 01 01 01 01 01 01 01 01 01 01 01 01 01
descriptor 1:    d9 65 00 50 a0 40 2e 60 08 20 08 08 1e b3 10 00 00 1a
descriptor 2:    7c 80 40 50 b0 08 34 70 08 20 68 08 1e b3 10 00 00 1a
descriptor 3:    00 00 00 fc 00 43 6f 6c 6f 72 20 4c 43 44 0a 20 20 20
descriptor 4:    00 00 00 10 00 00 00 00 00 00 00 00 00 00 00 00 00 00
extensions:      00
checksum:        7f

Manufacturer: APP Model a033 Serial Number 0
Made week 37 of 2015
EDID version: 1.4
Digital display
10 bits per primary color channel
DisplayPort interface
Maximum image size: 29 cm x 18 cm
Gamma: 2.20
Supported color formats: RGB 4:4:4
First detailed timing is preferred timing
Chroma Info:
Red X: 0.679688 Y: 0.320312
Green X: 0.264648 Y: 0.690430
Blue X: 0.152344 Y: 0.050781
White X: 0.312500 Y: 0.329102
Established timings supported:
Standard timings supported:
Detailed mode: Clock 260.730 MHz, 286 mm x 179 mm
               2560 2568 2600 2640 hborder 0
               1600 1632 1640 1646 vborder 0
               +hsync -vsync 
Detailed mode: Clock 328.920 MHz, 286 mm x 179 mm
               2880 2888 2920 2960 hborder 0
               1800 1838 1846 1852 vborder 0
               +hsync -vsync 
Monitor name: Color
Dummy block
Checksum: 0x7f (valid)
EDID block does NOT conform to EDID 1.3!
	Missing monitor ranges
	Detailed block string not properly terminated
