Extracted contents:
header:          00 ff ff ff ff ff ff 00
serial number:   06 10 f2 9c 00 00 00 00 1a 15
version:         01 04
basic params:    95 1a 0e 78 02
chroma info:     ef 05 97 57 54 92 27 22 50 54
established:     00 00 00
standard:        01 01 01 01 01 01 01 01 01 01 01 01 01 01 01 01
descriptor 1:    20 1c 56 86 50 00 20 30 0e 38 13 00 00 90 10 00 00 18
descriptor 2:    00 00 00 10 00 00 00 00 00 00 00 00 00 00 00 00 00 00
descriptor 3:    00 00 00 fe 00 4c 50 31 31 36 57 48 34 2d 54 4a 41 33
descriptor 4:    00 00 00 fc 00 43 6f 6c 6f 72 20 4c 43 44 0a 20 20 20
extensions:      00
checksum:        bd

Manufacturer: APP Model 9cf2 Serial Number 0
Made week 26 of 2011
EDID version: 1.4
Digital display
6 bits per primary color channel
DisplayPort interface
Maximum image size: 26 cm x 14 cm
Gamma: 2.20
Supported color formats: RGB 4:4:4
First detailed timing is preferred timing
Established timings supported:
Standard timings supported:
Detailed mode: Clock 72.000 MHz, 256 mm x 144 mm
               1366 1380 1436 1500 hborder 0
                768  769  772  800 vborder 0
               -hsync -vsync 
Dummy block
ASCII string: LP116WH4
Monitor name: Color
Checksum: 0xbd (valid)
EDID block does NOT conform to EDID 1.3!
	Missing monitor ranges
	Detailed block string not properly terminated
