Extracted contents:
header:          00 ff ff ff ff ff ff 00
serial number:   15 c3 86 17 01 01 01 01 05 10
version:         01 03
basic params:    80 26 1e 78 ea
chroma info:     e4 15 a3 54 4a 9b 25 13 50 54
established:     a1 08 00
standard:        81 80 01 01 01 01 01 01 01 01 01 01 01 01 01 01
descriptor 1:    30 2a 00 98 51 00 2a 40 30 70 13 00 78 2d 11 00 00 1e
descriptor 2:    00 00 00 ff 00 35 32 35 30 39 30 31 36 0a 20 20 20 20
descriptor 3:    00 00 00 fd 00 3b 3d 1f 40 0b 00 0a 20 20 20 20 20 20
descriptor 4:    00 00 00 fc 00 53 31 39 31 30 0a 20 20 20 20 20 20 20
extensions:      00
checksum:        df

Manufacturer: ENC Model 1786 Serial Number 16843009
Made week 5 of 2006
EDID version: 1.3
Digital display
Maximum image size: 38 cm x 30 cm
Gamma: 2.20
DPMS levels: Standby Suspend Off
Supported color formats: RGB 4:4:4, YCrCb 4:2:2
First detailed timing is preferred timing
Established timings supported:
  720x400@70Hz
  640x480@60Hz
  800x600@60Hz
  1024x768@60Hz
Standard timings supported:
  1280x1024@60Hz
Detailed mode: Clock 108.000 MHz, 376 mm x 301 mm
               1280 1328 1440 1688 hborder 0
               1024 1025 1028 1066 vborder 0
               +hsync +vsync 
Serial number: 52509016
Monitor ranges (GTF): 59-61Hz V, 31-64kHz H, max dotclock 110MHz
Monitor name: S1910
Checksum: 0xdf (valid)
