Extracted contents:
header:          00 ff ff ff ff ff ff 00
serial number:   06 10 f3 9c 00 00 00 00 23 14
version:         01 03
basic params:    80 1a 0e 78 0a
chroma info:     ef 05 97 57 54 92 27 22 50 54
established:     00 00 00
standard:        01 01 01 01 01 01 01 01 01 01 01 01 01 01 01 01
descriptor 1:    20 1c 56 86 50 00 20 30 0e 38 13 00 00 90 00 00 00 18
descriptor 2:    00 00 00 01 00 06 10 20 00 00 00 00 00 00 00 00 0a 20
descriptor 3:    00 00 00 fe 00 4c 54 48 31 31 36 41 54 30 31 41 30 31
descriptor 4:    00 00 00 fc 00 43 6f 6c 6f 72 20 4c 43 44 0a 20 20 20
extensions:      00
checksum:        af

Manufacturer: APP Model 9cf3 Serial Number 0
Made week 35 of 2010
EDID version: 1.3
Digital display
Maximum image size: 26 cm x 14 cm
Gamma: 2.20
Supported color formats: RGB 4:4:4, YCrCb 4:2:2
First detailed timing is preferred timing
Established timings supported:
Standard timings supported:
Detailed mode: Clock 72.000 MHz, 0 mm x 144 mm
               1366 1380 1436 1500 hborder 0
                768  769  772  800 vborder 0
               -hsync -vsync 
Manufacturer-specified data, tag 1
ASCII string: LTH116AT01A01
Monitor name: Color
Checksum: 0xaf (valid)
EDID block does NOT conform to EDID 1.3!
	Missing monitor ranges
	Detailed block string not properly terminated
