Extracted contents:
header:          00 ff ff ff ff ff ff 00
serial number:   10 ac c8 d0 55 56 54 31 0d 1c
version:         01 03
basic params:    80 2b 18 78 ea
chroma info:     da f5 a4 55 52 9f 27 0e 50 54
established:     a5 4a 00
standard:        71 4f a9 c0 01 01 01 01 01 01 01 01 01 01 01 01
descriptor 1:    30 2a 40 c8 60 84 64 30 18 50 13 00 b2 ec 10 00 00 1e
descriptor 2:    00 00 00 ff 00 4b 58 35 36 4a 38 33 55 31 54 56 55 0a
descriptor 3:    00 00 00 fc 00 44 45 4c 4c 20 50 32 30 31 38 48 0a 20
descriptor 4:    00 00 00 fd 00 38 4c 1e 53 11 00 0a 20 20 20 20 20 20
extensions:      01
checksum:        70

Manufacturer: DEL Model d0c8 Serial Number 827610709
Made week 13 of 2018
EDID version: 1.3
Digital display
Maximum image size: 43 cm x 24 cm
Gamma: 2.20
DPMS levels: Standby Suspend Off
Supported color formats: RGB 4:4:4, YCrCb 4:2:2
First detailed timing is preferred timing
Chroma Info:
Red X: 0.643555 Y: 0.333008
Green X: 0.322266 Y: 0.623047
Blue X: 0.155273 Y: 0.057617
White X: 0.313477 Y: 0.329102
Established timings supported:
  720x400@70Hz
  640x480@60Hz
  640x480@75Hz
  800x600@60Hz
  800x600@75Hz
  1024x768@60Hz
  1024x768@75Hz
Standard timings supported:
  1152x864@75Hz
  1600x900@60Hz
Detailed mode: Clock 108.000 MHz, 434 mm x 236 mm
               1600 1624 1704 1800 hborder 0
                900  901  904 1000 vborder 0
               +hsync +vsync 
Serial number: KX56J83U1TVU
Monitor name: DELL
Monitor ranges (GTF): 56-76Hz V, 30-83kHz H, max dotclock 170MHz
Has 1 extension blocks
Checksum: 0x70 (valid)

CEA extension block
Extension version: 3
19 bytes of CEA data
  Video data block
    VIC 16 1920x1080@60Hz (native)
    VIC 31 1920x1080@50Hz 
    VIC 01 640x480@60Hz 
    VIC 02 720x480@60Hz 
    VIC 03 720x480@60Hz 
    VIC 07 1440x480i@60Hz 
    VIC 18 720x576@50Hz 
    VIC 22 1440x576i@50Hz 
    VIC 04 1280x720@60Hz 
    VIC 19 1280x720@50Hz 
    VIC 20 1920x1080i@50Hz 
    VIC 05 1920x1080i@60Hz 
  Vendor-specific data block, OUI 000c03 (HDMI)
    Source physical address 1.0.0.0
Underscans PC formats by default
Supports YCbCr 4:4:4
Supports YCbCr 4:2:2
1 native detailed modes
Detailed mode: Clock 148.500 MHz, 434 mm x 236 mm
               1920 2008 2052 2200 hborder 0
               1080 1084 1089 1125 vborder 0
               +hsync +vsync 
Detailed mode: Clock 74.250 MHz, 434 mm x 236 mm
               1920 2008 2052 2200 hborder 0
                540  542  547  562 vborder 0
               +hsync +vsync interlaced 
Detailed mode: Clock 74.250 MHz, 434 mm x 236 mm
               1280 1390 1430 1650 hborder 0
                720  725  730  750 vborder 0
               +hsync +vsync 
Detailed mode: Clock 27.000 MHz, 434 mm x 236 mm
                720  736  798  858 hborder 0
                480  489  495  525 vborder 0
               -hsync -vsync 
Checksum: 0xe5 (valid)

EDID block does NOT conform to EDID 1.3!
	Detailed block string not properly terminated
