Extracted contents:
header:          00 ff ff ff ff ff ff 00
serial number:   05 e3 34 24 98 04 00 00 2a 13
version:         01 03
basic params:    80 34 1d 78 2a
chroma info:     ee d5 a5 55 48 9b 26 12 50 54
established:     bf ef 00
standard:        81 c0 81 40 81 80 b3 00 95 00 01 01 01 01 01 01
descriptor 1:    02 3a 80 18 71 38 2d 40 58 2c 45 00 09 25 21 00 00 1e
descriptor 2:    00 00 00 fd 00 38 4b 1e 50 11 00 0a 20 20 20 20 20 20
descriptor 3:    00 00 00 ff 00 50 34 38 39 41 4a 41 30 30 31 31 37 36
descriptor 4:    00 00 00 fc 00 32 34 33 34 0a 20 20 20 20 20 20 20 20
extensions:      01
checksum:        4f

Manufacturer: AOC Model 2434 Serial Number 1176
Made week 42 of 2009
EDID version: 1.3
Digital display
Maximum image size: 52 cm x 29 cm
Gamma: 2.20
DPMS levels: Off
Supported color formats: RGB 4:4:4, YCrCb 4:2:2
First detailed timing is preferred timing
Established timings supported:
  720x400@70Hz
  640x480@60Hz
  640x480@67Hz
  640x480@72Hz
  640x480@75Hz
  800x600@56Hz
  800x600@60Hz
  800x600@72Hz
  800x600@75Hz
  832x624@75Hz
  1024x768@60Hz
  1024x768@70Hz
  1024x768@75Hz
  1280x1024@75Hz
Standard timings supported:
  1280x720@60Hz
  1280x960@60Hz
  1280x1024@60Hz
  1680x1050@60Hz
  1440x900@60Hz
Detailed mode: Clock 148.500 MHz, 521 mm x 293 mm
               1920 2008 2052 2200 hborder 0
               1080 1084 1089 1125 vborder 0
               +hsync +vsync 
Monitor ranges (GTF): 56-75Hz V, 30-80kHz H, max dotclock 170MHz
Serial number: P489AJA001176
Monitor name: 2434
Has 1 extension blocks
Checksum: 0x4f (valid)

CEA extension block
Extension version: 3
24 bytes of CEA data
  Video data block
    VIC 16 
    VIC 04 
    VIC 03 
    VIC 31 
    VIC 19 
    VIC 18 
    VIC 05 
    VIC 20 
  Audio data block
    Linear PCM, max channels 1
    Supported sample rates (kHz): 48 44.1 32
    Supported sample sizes (bits): 24 20 16
  Speaker allocation data block
  Vendor-specific data block, OUI 000c03 (HDMI)
    Source physical address 1.0.0.0
Basic audio support
Supports YCbCr 4:4:4
Supports YCbCr 4:2:2
1 native detailed modes
Detailed mode: Clock 74.250 MHz, 474 mm x 296 mm
               1280 1390 1430 1650 hborder 0
                720  725  730  750 vborder 0
               +hsync +vsync 
Detailed mode: Clock 74.250 MHz, 474 mm x 296 mm
               1280 1720 1760 1980 hborder 0
                720  725  730  750 vborder 0
               +hsync +vsync 
Detailed mode: Clock 27.000 MHz, 474 mm x 296 mm
                720  736  798  858 hborder 0
                480  489  495  525 vborder 0
               -hsync -vsync 
Detailed mode: Clock 27.000 MHz, 474 mm x 296 mm
                720  732  796  864 hborder 0
                576  581  586  625 vborder 0
               -hsync -vsync 
Detailed mode: Clock 74.250 MHz, 474 mm x 296 mm
               1920 2008 2052 2200 hborder 0
                540  542  547  562 vborder 0
               +hsync +vsync interlaced 
Checksum: 0x1 (valid)

